velikost	forma	ico	nazev	obor_podnikani	status	platce_dph	rok_vzniku	obec	psc	statutari	nace_kody	okres	datum_vzniku
1-5	s.r.o.	04458419	Pediamar s.r.o.	Nespecializovaný velkoobchod; Nespecializovaný maloobchod; Všeobecná ambulantní zdravotní péče	aktivní	ne	2015	Lučany nad Nisou	46871	Šárka Marešová	46900;471;86210	Jablonec nad Nisou	2015-10-06
1-5	s.r.o.	04407032	H2real s.r.o.	Pronájem a správa vlastních nebo pronajatých nemovitostí; Opravy a údržba výrobků pro osobní potřebu a převážně pro domácnost; Poskytování ubytování; Činnosti reklamních agentur; Velkoobchod; Výroba, obchod a služby neuvedené v přílohách 1 až 3 živnostenského zákona; Nespecializovaný maloobchod; Pronájem a leasing výrobků pro osobní potřebu a převážně pro domácnost	aktivní	ano	2015	Jablonec nad Nisou	46601	Luboš Hajský	6820;952;55;73110;46;00;471;772	Jablonec nad Nisou	2015-09-17
1-5	s.r.o.	04385527	PZL ordinace Jablonec s.r.o.	Nespecializovaný velkoobchod; Nespecializovaný maloobchod; Zubní péče	aktivní	ne	2015	Jablonec nad Nisou	46604	Jitka Gogárová; Lenka Vondrušková	46900;471;86230	Jablonec nad Nisou	2015-09-14
1-5	s.r.o.	04345851	WILDZONE, s.r.o.	Výroba textilií; Zprostředkování v oblasti velkoobchodu za provizi; Nespecializovaný velkoobchod; Reklamní činnosti	aktivní	ne	2015	Jablonec nad Nisou	46602	Stanislav Drápalík	13;461;469;731	Jablonec nad Nisou	2015-08-26
1-5	s.r.o.	04303172	Caltero s.r.o.	Zprostředkování v oblasti velkoobchodu za provizi; Nespecializovaný velkoobchod; Nespecializovaný maloobchod; Ubytování v hotelích a podobných ubytovacích zařízeních; Počítačové programování, poradenství a související činnosti; Zprostředkování v oblasti nemovitostí; Reklamní činnosti; Ostatní odborné, vědecké a technické činnosti j. n.; Administrativní a kancelářské činnosti; Ostatní činnosti související se zdravotní péčí	aktivní	ne	2015	Liberec	46001	Michal Kalita	461;46900;471;55109;620;68310;731;74909;82110;8690	Liberec	2015-08-08
1-5	s.r.o.	04252101	Galaxy4bike Racing Parts s.r.o.	Výroba kovových konstrukcí a jejich dílů; Výroba nožířských výrobků; Výroba strojů a zařízení j. n.; Výroba motorových vozidel; Výroba dopravních prostředků a zařízení j. n.; Nespecializovaný velkoobchod; Nespecializovaný maloobchod	aktivní	ano	2015	Jablonec nad Nisou	46602	Lucie Hortová	25110;25610;28;29100;309;46900;471	Jablonec nad Nisou	2015-07-16
1-5	s.r.o.	03809935	Paradise Consulting, s. r. o.	Účetnické a auditorské činnosti; daňové poradenství; Činnosti reklamních agentur; Výroba, obchod a služby neuvedené v přílohách 1 až 3 živnostenského zákona; Ostatní pozemní osobní doprava j. n.; Administrativní a kancelářské činnosti	aktivní	ano	2015	Jablonec nad Nisou	46606	Jan Drábek	69200;73110;00;49399;82110	Jablonec nad Nisou	2015-02-26
1-5	s.r.o.	03808688	BUTTERFLY design s.r.o.	Nespecializovaný maloobchod; Počítačové programování, poradenství a související činnosti; Činnosti webových vyhledávacích portálů; Pronájem a leasing výrobků pro osobní potřebu a převážně pro domácnost; Pronájem a správa vlastních nebo pronajatých nemovitostí; Velkoobchod; Administrativní a kancelářské činnosti; Výroba, obchod a služby neuvedené v přílohách 1 až 3 živnostenského zákona; Ostatní vzdělávání; Účetnické a auditorské činnosti; daňové poradenství; Činnosti reklamních agentur	aktivní	ano	2015	Jablonec nad Nisou	46601	Pavel Prade	471;620;63910;772;6820;46;82110;00;855;69200;73110	Jablonec nad Nisou	2015-02-18
1-5	s.r.o.	03722465	LeghornGroup s.r.o.	Výroba pryžových a plastových výrobků; Zprostředkování v oblasti velkoobchodu za provizi; Nespecializovaný velkoobchod; Nespecializovaný maloobchod	aktivní	ano	2015	Jablonec nad Nisou	46601	Ivo Popelka	22;461;46900;471	Jablonec nad Nisou	2015-01-19
1-5	s.r.o.	03718271	Autobusy Holešovský s.r.o.	Opravy a údržba motorových vozidel, kromě motocyklů; Pravidelná silniční osobní doprava; Velkoobchod a maloobchod	aktivní	ano	2015	Jablonec nad Nisou	46605	Petr Holešovský	452;49310;G	Jablonec nad Nisou	2015-01-15
1-5	s.r.o.	03673529	LK cars s.r.o.	Opravy a údržba motorových vozidel, kromě motocyklů; Zprostředkování v oblasti velkoobchodu za provizi; Nespecializovaný velkoobchod; Nespecializovaný maloobchod; Maloobchod s použitým zbožím; Ostatní pozemní osobní doprava j. n.; Silniční nákladní doprava	aktivní	ano	2014	Jablonec nad Nisou	46605	Lubor Kalous	45200;461;46900;471;47790;49399;49410	Jablonec nad Nisou	2014-12-30
1-5	s.r.o.	03602184	Glass Pesničák s.r.o.	Výroba skla a skleněných výrobků; Výroba klenotů a příbuzných výrobků; Sběr odpadů, kromě nebezpečných; Zprostředkování v oblasti velkoobchodu za provizi; Nespecializovaný velkoobchod; Nespecializovaný maloobchod	aktivní	ano	2014	Jablonec nad Nisou	46604	Jan Pesničák	23190;3212;38110;461;46900;471	Jablonec nad Nisou	2014-11-27
1-5	s.r.o.	03509354	Golden Brands s.r.o.	Výroba, obchod a služby neuvedené v přílohách 1 až 3 živnostenského zákona; Velkoobchod; Umělecká tvorba a činnosti v oblasti scénických umění; Poskytování osobních služeb; Technické zkoušky a analýzy; Nespecializovaný maloobchod	aktivní	ano	2014	Jablonec nad Nisou	46602	Julija Grigorjevna Gurkina; Sergey Alexandrovič Gurkin	00;46;90020;96040;71209;471	Jablonec nad Nisou	2014-10-22
1-5	s.r.o.	03496953	CYCOLOGY s.r.o.	Výroba dopravních prostředků a zařízení j. n.; Maloobchod s použitým zbožím; Umělecká tvorba a činnosti v oblasti scénických umění; Činnosti v oblasti sportu j. n.; Činnosti reklamních agentur; Velkoobchod; Maloobchod s hrami a hračkami; Pronájem a leasing výrobků pro osobní potřebu a převážně pro domácnost; Ostatní vzdělávání; Opravy a údržba přístrojů a zařízení převážně pro domácnost, dům a zahradu	insolvence	ano	2014	Jablonec nad Nisou	46601	Martin Kudrna; Jan Coufal	309;47790;90020;93190;73110;46;47640;772;855;95220	Jablonec nad Nisou	2014-10-17
1-5	s.r.o.	03451976	TRAFIKANTKY s.r.o.	Destilace, rektifikace a míchaní lihovin; Zprostředkování v oblasti velkoobchodu za provizi; Nespecializovaný maloobchod; Pronájem a správa vlastních nebo pronajatých nemovitostí	aktivní	ano	2014	Jablonec nad Nisou	46804	Daniela Morávková	11010;461;471;6820	Jablonec nad Nisou	2014-10-01
1-5	s.r.o.	03364607	Profesionální přeprava s.r.o.	Silniční nákladní doprava; Úklidové činnosti	aktivní	ano	2014	Jablonec nad Nisou	46604	Jaroslav Maruška	49410;812	Jablonec nad Nisou	2014-09-03
1-5	s.r.o.	03346463	Agentura Recese s.r.o.	Výroba, obchod a služby neuvedené v přílohách 1 až 3 živnostenského zákona; Ostatní odborné, vědecké a technické činnosti	aktivní	ano	2014	Jablonec nad Nisou	46602	Robert Pánek	00;74	Jablonec nad Nisou	2014-08-28
1-5	s.r.o.	03296181	DRAJANA s.r.o.	Výroba pletených a háčkovaných oděvů; Výroba elektronických součástek; Ostatní zpracovatelský průmysl; Zprostředkování v oblasti velkoobchodu za provizi; Skladování; Účetnické a auditorské činnosti; daňové poradenství; Technické zkoušky a analýzy; Administrativní a kancelářské činnosti; Poskytování osobních služeb; Poskytování osobních služeb	aktivní	ano	2014	Jablonec nad Nisou	46601	Naděžda Jonášová; Lenka Masini Jonášová	141;26110;32;461;52100;69200;7120;821;96010;96090	Jablonec nad Nisou	2014-08-14
1-5	s.r.o.	03194680	Meretech s.r.o.	Nespecializovaný maloobchod; Opravy a údržba výrobků pro osobní potřebu a převážně pro domácnost; Instalace průmyslových strojů a zařízení; Výroba ostatních elektrických zařízení; Velkoobchod	aktivní	ano	2014	Jablonec nad Nisou	46804	Martin Preissler; Michaela Tesařová	471;952;33200;27900;46	Jablonec nad Nisou	2014-07-14
1-5	s.r.o.	03106829	Budovy EKO s.r.o.	Demolice a příprava staveniště; Elektroinstalační, instalatérské a ostatní stavebně instalační činnosti; Zprostředkování v oblasti velkoobchodu za provizi; Poskytování ubytování; Činnosti v oblasti nemovitostí na základě smlouvy nebo dohody; Architektonické činnosti; Inženýrské činnosti a související technické poradenství; Technické zkoušky a analýzy; Specializované návrhářské činnosti; Ostatní odborné, vědecké a technické činnosti j. n.; Ostatní vzdělávání	aktivní	ano	2014	Jablonec nad Nisou	46601	Ondřej Černý	431;432;461;55;683;71110;7112;71209;74100;7490;855	Jablonec nad Nisou	2014-06-16
1-5	s.r.o.	02745305	Ereon s.r.o.	Výroba, obchod a služby neuvedené v přílohách 1 až 3 živnostenského zákona; Instalace průmyslových strojů a zařízení; Sběr odpadů, kromě nebezpečných; Výstavba bytových a nebytových budov; Příprava staveniště; Sklenářské, malířské a natěračské práce; Opravy a údržba motorových vozidel, kromě motocyklů; Nespecializovaný velkoobchod; Nespecializovaný maloobchod; Silniční nákladní doprava; Skladování a podpůrné činnosti pro dopravu; Pronájem a správa vlastních nebo pronajatých nemovitostí; Inženýrské činnosti a související technické poradenství; Pronájem a leasing výrobků pro osobní potřebu a převážně pro domácnost	aktivní	ano	2014	Jablonec nad Nisou	46605	Petr Hlava; Šimon Hulan	00;33200;38110;4120;43120;43341;45200;46900;471;49410;52;6820;7112;772	Jablonec nad Nisou	2014-03-11
1-5	s.r.o.	02589362	KAPEKO s.r.o.	Pronájem a leasing výrobků pro osobní potřebu a převážně pro domácnost; Úklidové činnosti; Administrativní a kancelářské činnosti; Ostatní vzdělávání j. n.; Umělecká tvorba a činnosti v oblasti scénických umění; Poskytování osobních služeb; Nespecializovaný maloobchod; Skladování a podpůrné činnosti pro dopravu; Zprostředkování v oblasti nemovitostí; Účetnické a auditorské činnosti; daňové poradenství; Reklamní činnosti; Ostatní odborné, vědecké a technické činnosti j. n.; Ostatní zpracovatelský průmysl; Zprostředkování v oblasti velkoobchodu za provizi; Nespecializovaný velkoobchod	aktivní	ano	2014	Jablonec nad Nisou	46605	Kateřina Kotková	77290;812;821;8559;90020;96090;471;52;68310;69200;731;74909;32;461;46900	Jablonec nad Nisou	2014-01-27
1-5	s.r.o.	02456150	BIS GYN s.r.o.	Výroba, obchod a služby neuvedené v přílohách 1 až 3 živnostenského zákona; Velkoobchod; Nespecializovaný maloobchod; Specializovaná ambulantní zdravotní péče; Poskytování osobních služeb	aktivní	ne	2013	Pěnčín	46821	Ivana Svobodová	00;46;471;86220;96090	Jablonec nad Nisou	2013-12-23
1-5	s.r.o.	02351072	Reaps s.r.o.	Výroba elektronických součástek a desek; Výroba elektrických zařízení; Nespecializovaný velkoobchod; Nespecializovaný maloobchod; Ostatní vydavatelské činnosti, kromě vydávání softwaru; Počítačové programování, poradenství a související činnosti; Inženýrské činnosti a související technické poradenství; Technické zkoušky a analýzy; Ostatní odborné, vědecké a technické činnosti j. n.; Pronájem a leasing výrobků pro osobní potřebu a převážně pro domácnost; Ostatní vzdělávání j. n.	aktivní	ano	2013	Jablonec nad Nisou	46605	Jaroslav Ekl	261;27;46900;471;58190;62;7112;71209;74909;77290;8559	Jablonec nad Nisou	2013-11-25
1-5	s.r.o.	01970984	Petr praktik s.r.o.	Zprostředkování v oblasti velkoobchodu za provizi; Nespecializovaný velkoobchod; Nespecializovaný maloobchod; Všeobecná ambulantní zdravotní péče	aktivní	ne	2013	Pěnčín	46821	Petra Petrová; Ivo Petr	461;46900;471;86210	Jablonec nad Nisou	2013-08-09
1-5	s.r.o.	01925474	D-H EXPRESS s.r.o.	Nespecializovaný velkoobchod; Nespecializovaný maloobchod	aktivní	ano	2013	Jablonec nad Nisou	46801	Dinh Dung Le	46900;471	Jablonec nad Nisou	2013-07-24
1-5	s.r.o.	01879570	RAL Projekt s.r.o.	Demolice a příprava staveniště; Pronájem a správa vlastních nebo pronajatých nemovitostí; Architektonické činnosti; Ostatní odborné, vědecké a technické činnosti j. n.; Výroba, obchod a služby neuvedené v přílohách 1 až 3 živnostenského zákona; Výstavba bytových a nebytových budov	aktivní	ano	2013	Jablonec nad Nisou	46605	Radka Louthanová	431;6820;71110;74901;00;4120	Jablonec nad Nisou	2013-07-26
1-5	s.r.o.	01590502	ProReal 2013, s.r.o.	Výstavba silnic a železnic; Nespecializovaný velkoobchod; Nespecializovaný maloobchod; Zprostředkování v oblasti nemovitostí; Architektonické činnosti	aktivní	ano	2013	Jablonec nad Nisou	46602	Marek Nový	421;46900;471;68310;71110	Jablonec nad Nisou	2013-04-22
1-5	s.r.o.	00569950	VKPI INVEST s.r.o.	Výroba, obchod a služby neuvedené v přílohách 1 až 3 živnostenského zákona; Ostatní zpracovatelský průmysl; Nespecializovaný maloobchod; Pronájem a správa vlastních nebo pronajatých nemovitostí; Činnosti v oblasti sportu j. n.; Administrativní a kancelářské činnosti; Činnosti reklamních agentur; Poskytování ubytování; Ostatní vzdělávání; Nespecializovaný velkoobchod; Umělecká tvorba a činnosti v oblasti scénických umění	aktivní	ano	1990	Jablonec nad Nisou	46601	Petr Pluhař; Michal Rozsíval	00;32;471;6820;93190;82110;73110;55;855;46900;90020	Jablonec nad Nisou	1990-11-06
1-5	s.r.o.	00525952	C26 s.r.o.	Zprostředkování v oblasti velkoobchodu za provizi; Maloobchod s výrobky pro kulturní rozhled a rekreaci; Maloobchod s ostatním novým zbožím; Reklamní činnosti; Ostatní odborné, vědecké a technické činnosti; Činnosti v oblasti sportu	aktivní	ano	1990	Jablonec nad Nisou	46602	Jan Verl	461;47650;4778;731;74;931	Jablonec nad Nisou	1990-08-03
1-5	a.s.	27343413	QF INVESTMENT, a.s.	Pronájem a správa vlastních nebo pronajatých nemovitostí	aktivní	ne	2007	Jablonec nad Nisou	46601	Martin Řezáč; Radek Matějček	6820	Jablonec nad Nisou	2007-12-21
1-5	a.s.	26402548	SKÁLA SF a.s.	Velkoobchod; Výroba, obchod a služby neuvedené v přílohách 1 až 3 živnostenského zákona; Maloobchod; Poskytování ubytování	aktivní	ano	2005	Jablonec nad Nisou	46601	Martin Bauer	46;00;47;55	Jablonec nad Nisou	2005-12-14
1-5	a.s.	25420721	INTERIMEX CZ a.s.	Výroba, obchod a služby neuvedené v přílohách 1 až 3 živnostenského zákona; Pronájem a správa vlastních nebo pronajatých nemovitostí; Maloobchod s oděvy; Výroba pryžových a plastových výrobků; Velkoobchod s oděvy a obuví; Výroba oděvů; Činnosti reklamních agentur	aktivní	ano	2000	Jablonec nad Nisou	46601	Tomáš Ouvín; Blanka Ouvínová; Kristýna Ouvínová	00;6820;47710;22;4642;14;73110	Jablonec nad Nisou	2000-09-14
1-5	a.s.	25415212	BRENTO, a.s.	Zprostředkování v oblasti velkoobchodu za provizi; Nespecializovaný velkoobchod; Nespecializovaný maloobchod; Zprostředkování v oblasti nemovitostí; Poradenství v oblasti podnikání a řízení podniků; Reklamní činnosti; Pronájem a leasing výrobků pro osobní potřebu a převážně pro domácnost	aktivní	ano	2000	Jablonec nad Nisou	46601	Pavel Krejčík; Kamil Krejčík	461;46900;471;68310;702;731;772	Jablonec nad Nisou	2000-03-15
1-5	a.s.	14438097	ATREA Group a.s.	Výroba, obchod a služby neuvedené v přílohách 1 až 3 živnostenského zákona; Nespecializovaný velkoobchod; Nespecializovaný maloobchod; Pronájem a správa vlastních nebo pronajatých nemovitostí; Pronájem a správa vlastních nebo pronajatých nemovitostí; Reklamní činnosti; Administrativní a kancelářské činnosti	aktivní	ano	2022	Jablonec nad Nisou	46605	Daniel Morávek; Petr Morávek; Taťána Morávková	00;46900;471;68203;68204;731;82110	Jablonec nad Nisou	2022-04-11
1-5	a.s.	04608518	JNC HOLDING, a.s.	Pronájem a správa vlastních nebo pronajatých nemovitostí	aktivní	ne	2015	Jablonec nad Nisou	46601	Milan Zemánek; Martin Řezáč	6820	Jablonec nad Nisou	2015-12-01
1-5	a.s.	04066529	JABLOTRON GROUP a.s.	Výroba, obchod a služby neuvedené v přílohách 1 až 3 živnostenského zákona; Činnosti holdingových společností a účelových finančních společností; Pronájem a správa vlastních nebo pronajatých nemovitostí; Pronájem a leasing výrobků pro osobní potřebu a převážně pro domácnost; Úklidové činnosti; Administrativní a kancelářské činnosti	aktivní	ano	2015	Jablonec nad Nisou	46601	Dalibor Dědek; Tereza Nalezená	00;64200;6820;772;812;82110	Jablonec nad Nisou	2015-05-11
neuv.	s.r.o.	65412681	DEVIN s.r.o.	Velkoobchod; Pronájem a správa vlastních nebo pronajatých nemovitostí; Nespecializovaný maloobchod; Poradenství v oblasti podnikání a řízení podniků	aktivní	ne	1996	Jablonec nad Nisou	46601	Lukáš Pleticha	46;6820;471;702	Jablonec nad Nisou	1996-04-15
neuv.	s.r.o.	64941647	VH meat s.r.o.	Výroba, obchod a služby neuvedené v přílohách 1 až 3 živnostenského zákona; Destilace, rektifikace a míchaní lihovin; Nespecializovaný velkoobchod; Nespecializovaný maloobchod; Poskytování ubytování; Poskytování stravování v restauracích, u stánků a mobilních zařízení	aktivní	ne	1996	Jablonec nad Nisou	46605	Václav Petráček	00;11010;46900;471;55;56100	Jablonec nad Nisou	1996-01-02
neuv.	s.r.o.	64052842	R. U. S. Team s.r.o. v likvidaci	Reklamní činnosti	aktivní	ne	1995			Radek Vincent Urbanec	731		1995-12-07
neuv.	s.r.o.	64048756	AQUARIUM ZÁVACKÝ společnost s ručením omezeným	Nespecializovaný maloobchod s převahou potravin, nápojů a tabákových výrobků	aktivní	ne	1995	Jablonec nad Nisou	46602	Petr Závacký	47110	Jablonec nad Nisou	1995-10-02
neuv.	s.r.o.	63148781	ROOF-COMPANY s.r.o.	Zednické práce; Nespecializovaný maloobchod s převahou potravin, nápojů a tabákových výrobků	aktivní	ne	1995	Jablonec nad Nisou	46604	David Bartel	43910;47110	Jablonec nad Nisou	1995-09-19
neuv.	s.r.o.	63146789	MIRIEG s.r.o., v likvidaci	Nespecializovaný maloobchod s převahou potravin, nápojů a tabákových výrobků	aktivní	ne	1995	Jablonec nad Nisou	46605	Jitka Brzáková	47110	Jablonec nad Nisou	1995-09-01
neuv.	s.r.o.	63146614	PILA LUČANY s.r.o. v likvidaci	Podpůrné činnosti pro zemědělství a posklizňové činnosti; Pilařská výroba a impregnace dřeva; zpracování a konečná úprava dřeva; Truhlářské práce; Nespecializovaný maloobchod; Velkoobchod; Zednické práce	aktivní	ne	1995	Jablonec nad Nisou	46602	Radomír Fabián; Jaroslava Vančurová	016;16100;43320;471;46;43910	Jablonec nad Nisou	1995-06-30
neuv.	s.r.o.	62742906	MARCO - Jablonec n/N s.r.o., v likvidaci	Nespecializovaný maloobchod s převahou potravin, nápojů a tabákových výrobků	aktivní	ne	1995	Jablonec nad Nisou	46801	Jiří Markvart	47110	Jablonec nad Nisou	1995-04-24
neuv.	s.r.o.	62740512	G & B bijoux, s.r.o.	Výroba bižuterie a příbuzných výrobků; Nespecializovaný maloobchod s převahou potravin, nápojů a tabákových výrobků	aktivní	ne	1995			Zuzana Slámová	32130;47110		1995-03-09
neuv.	s.r.o.	62243578	H A R Y  PLUS, spol. s r.o.	Zpracování a konzervování masa a výroba masných výrobků; Nespecializovaný maloobchod; Maloobchod s masem a masnými výrobky; Poskytování stravování v restauracích, u stánků a mobilních zařízení; Ostatní odborné, vědecké a technické činnosti	aktivní	ne	1994			Martin Šmíd	101;471;47220;56100;74		1994-12-29
neuv.	s.r.o.	62243284	TEPOS - ARTMETAL CS s.r.o.	Podpůrné činnosti pro podnikání j. n.; Výroba ostatních kovových výrobků j. n.; Nespecializovaný maloobchod s převahou potravin, nápojů a tabákových výrobků; Poradenství v oblasti podnikání a řízení podniků	aktivní	ne	1994	Jablonec nad Nisou	46801		829;25990;47110;702	Jablonec nad Nisou	1994-12-22
neuv.	s.r.o.	62240579	Česká novobau spol. s r.o. v likvidaci	Výstavba bytových a nebytových budov	aktivní	ne	1994	Jablonec nad Nisou	46804		41202	Jablonec nad Nisou	1994-11-28
neuv.	s.r.o.	62240277	Manfred Knoche & Co. Bau-Industriemaschinen  s.r.o.	Demolice a příprava staveniště; Nespecializovaný maloobchod	aktivní	ne	1994	Jablonec nad Nisou	46604	Vladimír Fabián	431;471	Jablonec nad Nisou	1994-12-01
neuv.	s.r.o.	61539929	MIAGA spol. s r.o.	Výroba pekařských a cukrářských výrobků, kromě trvanlivých; Výroba kovových výrobků, kromě strojů a zařízení; Výroba elektrických rozvodných a kontrolních zařízení; Nespecializovaný maloobchod; Podpůrné činnosti pro dopravu; Poskytování stravování v restauracích, u stánků a mobilních zařízení; Architektonické a inženýrské činnosti a související technické poradenství; Pátrací a bezpečnostní činnosti	aktivní	ne	1994	Jablonec nad Nisou	46606	Václav Malý	10710;25720;27120;471;52290;56100;711;80	Jablonec nad Nisou	1994-11-09
neuv.	s.r.o.	61539627	F.C.M., s.r.o.	Nespecializovaný maloobchod s převahou potravin, nápojů a tabákových výrobků; Počítačové programování, poradenství a související činnosti; Pojišťovací činnosti; Zprostředkování v oblasti nemovitostí; Poradenství v oblasti podnikání a řízení podniků; Reklamní činnosti; Podpůrné činnosti pro podnikání j. n.; Ostatní vzdělávání j. n.; Činnosti pojišťovacích makléřů a agentů	aktivní	ne	1994	Jablonec nad Nisou	46601	Martin Blaschke	47110;620;651;68310;702;731;829;8559;66220	Jablonec nad Nisou	1994-11-04
neuv.	s.r.o.	61326259	INSTAPEX spol. s r.o.	Výstavba ostatních inženýrských děl j. n.	aktivní	ne	1994	Jablonec nad Nisou	46604	Petr Fuljer; Bohumil Tůma; Josef Havránek	42990	Jablonec nad Nisou	1994-05-25
neuv.	s.r.o.	61325317	2M Racing, s.r.o.	Architektonické a inženýrské činnosti a související technické poradenství; Reklamní činnosti; Činnosti v oblasti zábavy a rekreace j. n.	aktivní	ano	1994			Miroslav Krejsa; Martina Hejdová	711;731;93290		1994-05-11
neuv.	s.r.o.	60281707	SPORT MANAGEMENT ADVERTISING s.r.o.	Nespecializovaný maloobchod	zaniklý	ne	1994	Jablonec nad Nisou	46605		471	Jablonec nad Nisou	1994-04-11
neuv.	s.r.o.	60279834	STEFANEL, spol. s r.o., v likvidaci, zkráceně: STEFANEL, s.r.o. v likvidaci	Nespecializovaný maloobchod s převahou potravin, nápojů a tabákových výrobků	aktivní	ne	1994	Jablonec nad Nisou	46604	Jana Zelenková	47110	Jablonec nad Nisou	1994-03-18
neuv.	s.r.o.	60279419	KOBI, s.r.o.	Ostatní zpracovatelský průmysl	aktivní	ne	1994	Jablonec nad Nisou	46601	Ondřej Bělský	32	Jablonec nad Nisou	1994-03-14
neuv.	s.r.o.	60277131	LaVer, společnost s ručením omezeným	Výroba pekařských, cukrářských a jiných moučných výrobků; Destilace, rektifikace a míchaní lihovin; Ostatní zpracovatelský průmysl; Nespecializovaný velkoobchod; Nespecializovaný maloobchod; Nespecializovaný maloobchod s převahou potravin, nápojů a tabákových výrobků; Skladování; Poskytování stravování v restauracích, u stánků a mobilních zařízení; Činnosti v oblasti sportu j. n.	aktivní	ne	1994	Jablonec nad Nisou	46601	Vladimír Krásný	107;11010;32;46900;471;47110;52100;56100;93190	Jablonec nad Nisou	1994-02-10
neuv.	s.r.o.	49902237	Bohemia Racing, s.r.o.	Opravy a údržba motorových vozidel, kromě motocyklů; Nespecializovaný maloobchod; Reklamní činnosti; Ostatní odborné, vědecké a technické činnosti; Pronájem a leasing osobních automobilů a lehkých motorových vozidel; Úklidové činnosti	aktivní	ano	1993	Jablonec nad Nisou	46605	Václav Adamec; Tomáš Pour	45200;471;731;74;77110;812	Jablonec nad Nisou	1993-12-13
neuv.	s.r.o.	49901362	ANNA-B, s.r.o. v likvidaci	Výroba bižuterie a příbuzných výrobků; Zprostředkování v oblasti velkoobchodu za provizi	aktivní	ne	1994	Jablonec nad Nisou	46605	Václav Vosáhlo	32130;461	Jablonec nad Nisou	1994-01-01
neuv.	s.r.o.	49900811	LUCCIO s.r.o.	Zprostředkování v oblasti velkoobchodu za provizi; Činnosti v oblasti filmů, videozáznamů a televizních pořadů, pořizování zvukových nahrávek a hudební vydavatelské činnosti; Umělecká tvorba a činnosti v oblasti scénických umění	aktivní	ne	1993	Jablonec nad Nisou	46601	Pavel Hamatschek; Přemysl Puchr	461;59;900	Jablonec nad Nisou	1993-11-19
neuv.	s.r.o.	49682679	ULTIMA OIL, s.r.o. v likvidaci	Zprostředkování v oblasti velkoobchodu za provizi; Specializovaný velkoobchod s ostatními potravinami; Nespecializovaný maloobchod; Poskytování stravování v restauracích, u stánků a mobilních zařízení; Zprostředkování v oblasti nemovitostí	aktivní	ne	1993	Jablonec nad Nisou	46605	Marek Jansta	461;46380;471;56100;68310	Jablonec nad Nisou	1993-07-20
neuv.	s.r.o.	49098349	ALMIDAN, spol. s r.o.	Zprostředkování v oblasti velkoobchodu za provizi	aktivní	ne	1993	Jablonec nad Nisou	46605	Milan Houdek	461	Jablonec nad Nisou	1993-09-09
neuv.	s.r.o.	48528331	EFAdesigner s.r.o., v likvidaci	Nespecializovaný maloobchod	aktivní	ne	1993	Jablonec nad Nisou	46604		47190	Jablonec nad Nisou	1993-04-23
neuv.	s.r.o.	48291935	Spectrum Aerospace s.r.o.	Zprostředkování v oblasti velkoobchodu za provizi	aktivní	ne	1993	Jablonec nad Nisou	46605	Ivo Franěk	461	Jablonec nad Nisou	1993-06-17
neuv.	s.r.o.	48290246	PHP s.r.o. v likvidaci	Činnosti heren, kasin a sázkových kanceláří	aktivní	ne	1993	Jablonec nad Nisou	46801	Martin Hála	92000	Jablonec nad Nisou	1993-05-27
neuv.	s.r.o.	48269832	CJ Projekt s.r.o.	Zprostředkování v oblasti velkoobchodu za provizi	aktivní	ne	1993	Jablonec nad Nisou	46602	Martin Juris	461	Jablonec nad Nisou	1993-04-16
neuv.	s.r.o.	48268623	Chron Art s.r.o.	Výstavba bytových a nebytových budov; Nespecializovaný velkoobchod; Nespecializovaný maloobchod	aktivní	ne	1993	Jablonec nad Nisou	46602	Miloš Vajner	4120;46900;47190	Jablonec nad Nisou	1993-03-31
