velikost	forma	ico	nazev	obor_podnikani	status	platce_dph	rok_vzniku	obec	psc	statutari	nace_kody	okres	datum_vzniku
1-5	s.r.o.	28721942	Singltrek, s.r.o.	Výroba, obchod a služby neuvedené v přílohách 1 až 3 živnostenského zákona; Podpůrné činnosti pro zemědělství a posklizňové činnosti; Výroba pletených a háčkovaných oděvů; Tisk a rozmnožování nahraných nosičů; Demolice a příprava staveniště; Kompletační a dokončovací stavební práce; Zprostředkování v oblasti velkoobchodu za provizi; Ubytování v hotelích a podobných ubytovacích zařízeních; Počítačové programování, poradenství a související činnosti; Poskytování počítačové infrastruktury, zpracování dat, hosting a ostatní informační činnosti; Zprostředkování v oblasti nemovitostí; Poradenství v oblasti podnikání a řízení podniků; Architektonické a inženýrské činnosti a související technické poradenství; Architektonické činnosti; Reklamní činnosti; Fotografické činnosti; Činnosti cestovních agentur; Ostatní vzdělávání j. n.; Činnosti v oblasti sportu	aktivní	ano	2010	Jablonec nad Nisou	46604	Tomáš Kvasnička	00;016;141;18;431;433;461;55109;620;63;68310;702;711;71110;731;74200;79110;8559;931	Jablonec nad Nisou	2010-05-01
1-5	s.r.o.	28720181	OPTIMASTAV group s.r.o.	Výstavba bytových a nebytových budov; Demolice a příprava staveniště; Kompletační a dokončovací stavební práce; Zprostředkování v oblasti velkoobchodu za provizi; Nespecializovaný velkoobchod; Maloobchod; Zprostředkování v oblasti nemovitostí; Architektonické a inženýrské činnosti a související technické poradenství; Pronájem a leasing výrobků pro osobní potřebu a převážně pro domácnost	aktivní	ano	2010	Jablonec nad Nisou	46601	Miroslava Zmrzlá; Radovan Zmrzlý	4120;431;433;461;46900;47;68310;711;772	Jablonec nad Nisou	2010-03-19
1-5	s.r.o.	28719921	PROFI FITNESS, s.r.o.	Destilace, rektifikace a míchaní lihovin; Zprostředkování v oblasti velkoobchodu za provizi; Nespecializovaný velkoobchod; Maloobchod; Maloobchod s použitým zbožím; Poskytování stravování v restauracích, u stánků a mobilních zařízení; Poradenství v oblasti podnikání a řízení podniků; Technické zkoušky a analýzy; Reklamní činnosti; Pronájem a leasing výrobků pro osobní potřebu a převážně pro domácnost; Ostatní vzdělávání j. n.; Činnosti v oblasti sportu; Poskytování osobních služeb	aktivní	ano	2010	Jablonec nad Nisou	46605	Petros Kalpakcis	11010;461;46900;47;47790;561;702;7120;731;772;8559;931;96040	Jablonec nad Nisou	2010-04-01
1-5	s.r.o.	28719832	ORLAFON s.r.o.	Zprostředkování v oblasti velkoobchodu za provizi; Nespecializovaný velkoobchod; Maloobchod; Poradenství v oblasti podnikání a řízení podniků; Ostatní odborné, vědecké a technické činnosti; Pronájem a leasing výrobků pro osobní potřebu a převážně pro domácnost; Ambulantní a zubní zdravotní péče	aktivní	ne	2010	Jablonec nad Nisou	46604	Marek Bursa	461;46900;47;702;74;772;862	Jablonec nad Nisou	2010-03-16
1-5	s.r.o.	28717830	Azet Group s.r.o.	Výroba kovových konstrukcí a jejich dílů; Výroba nožířských výrobků, nástrojů a železářských výrobků; Výroba kovových výrobků, kromě strojů a zařízení; Demolice a příprava staveniště; Elektrické instalace; Kompletační a dokončovací stavební práce; Zprostředkování v oblasti velkoobchodu za provizi; Nespecializovaný velkoobchod; Maloobchod; Ubytování v hotelích a podobných ubytovacích zařízeních; Technické zkoušky a analýzy; Pronájem a leasing výrobků pro osobní potřebu a převážně pro domácnost; Úklidové činnosti	aktivní	ano	2010	Jablonec nad Nisou	46601	Tomáš Janoušek; Pavel Janoušek	25110;256;25720;431;43210;433;461;46900;47;55109;7120;772;812	Jablonec nad Nisou	2010-02-09
1-5	s.r.o.	28716744	Ing. Vladimír Opatrný s.r.o.	Zprostředkování v oblasti velkoobchodu za provizi; Účetnické a auditorské činnosti; daňové poradenství; Ostatní odborné, vědecké a technické činnosti; Ostatní vzdělávání	aktivní	ano	2010	Jablonec nad Nisou	46601	Vladimír Opatrný	461;69200;74;855	Jablonec nad Nisou	2010-02-01
1-5	s.r.o.	28715403	Metodia s.r.o.	Velkoobchod; Účetnické a auditorské činnosti; daňové poradenství; Výroba, obchod a služby neuvedené v přílohách 1 až 3 živnostenského zákona; Nespecializovaný maloobchod	aktivní	ano	2010	Jablonec nad Nisou	46606	Michaela Černohousová; Bohumil Černohous	46;69200;00;471	Jablonec nad Nisou	2010-01-13
1-5	s.r.o.	28709969	BIJOUX-PRO spol. s r.o.	Zprostředkování v oblasti velkoobchodu za provizi; Nespecializovaný velkoobchod; Maloobchod; Překladatelské a tlumočnické činnosti	aktivní	ano	2009	Jablonec nad Nisou	46601	Jan Orendáš	461;46900;47;74300	Jablonec nad Nisou	2009-09-29
1-5	s.r.o.	28709110	LIDAS GROUP s.r.o.	Destilace, rektifikace a míchaní lihovin; Zprostředkování v oblasti velkoobchodu za provizi; Velkoobchod s textilem; Ostatní pozemní osobní doprava j. n.; Poskytování stravování v restauracích, u stánků a mobilních zařízení; Zprostředkování v oblasti nemovitostí; Reklamní činnosti	aktivní	ano	2009	Jablonec nad Nisou	46602	Libuše Šlechtová	11010;461;46410;49399;56100;68310;731	Jablonec nad Nisou	2009-09-16
1-5	s.r.o.	28708784	JEDLOM s.r.o.	Zprostředkování v oblasti velkoobchodu za provizi	aktivní	ano	2009	Jablonec nad Nisou	46606	Jakub Seifert; Milan Mašek	461	Jablonec nad Nisou	2009-09-23
1-5	s.r.o.	28706986	ŠENÝR Bijoux s.r.o.	Ostatní zpracovatelský průmysl j. n.; Nespecializovaný velkoobchod; Maloobchod	aktivní	ano	2009	Jablonec nad Nisou	46601	Olga Kopalová	32990;46900;47	Jablonec nad Nisou	2009-08-13
1-5	s.r.o.	28705971	KPSYSTEM s.r.o.	Elektrické instalace; Nespecializovaný velkoobchod; Maloobchod; Počítačové programování, poradenství a související činnosti; Poskytování počítačové infrastruktury, zpracování dat, hosting a ostatní informační činnosti; Pátrací a bezpečnostní činnosti	aktivní	ano	2009	Jablonec nad Nisou	46604	Gabriela Karbanová	43210;46900;47;620;63;80200	Jablonec nad Nisou	2009-08-11
1-5	s.r.o.	28703570	JZ kuchyňské studio s.r.o.	Architektonické a inženýrské činnosti a související technické poradenství; Úklidové činnosti; Zprostředkování v oblasti velkoobchodu za provizi; Maloobchod; Maloobchod s použitým zbožím; Poradenství v oblasti podnikání a řízení podniků	aktivní	ano	2009	Jablonec nad Nisou	46602	Michal Zabořil	711;812;461;47;47790;702	Jablonec nad Nisou	2009-07-02
1-5	s.r.o.	28700881	KALIX s.r.o.	Výroba zámků a kování; Výroba kovových výrobků, kromě strojů a zařízení; Výroba ostatních elektrických zařízení; Demolice a příprava staveniště; Elektrické instalace; Kompletační a dokončovací stavební práce; Zprostředkování v oblasti velkoobchodu za provizi; Nespecializovaný velkoobchod; Maloobchod; Poradenství v oblasti podnikání a řízení podniků; Architektonické a inženýrské činnosti a související technické poradenství; Technické zkoušky a analýzy; Úklidové činnosti; Opravy a údržba počítačů a komunikačních zařízení	aktivní	ano	2009	Jablonec nad Nisou	46601	Jiří Beitl	25620;25720;27900;431;43210;433;461;46900;47;702;711;7120;812;95110	Jablonec nad Nisou	2009-06-03
1-5	s.r.o.	28696905	TOP-SERVIS JN s.r.o.	Příprava tisku a digitálních dat; Výroba kovových konstrukcí a jejich dílů; Výroba nožířských výrobků, nástrojů a železářských výrobků; Demolice a příprava staveniště; Instalace rozvodů vody, odpadu, topení a klimatizace; Kompletační a dokončovací stavební práce; Zprostředkování v oblasti velkoobchodu za provizi; Nespecializovaný velkoobchod; Maloobchod; Poradenství v oblasti podnikání a řízení podniků; Technické zkoušky a analýzy	aktivní	ano	2009	Jablonec nad Nisou	46601	Jaroslav Nikodým	18130;25110;256;431;43220;433;461;46900;47;702;7120	Jablonec nad Nisou	2009-04-01
1-5	s.r.o.	28690125	ABcomp.cz, s.r.o.	Tisk a činnosti související s tiskem; Instalace průmyslových strojů a zařízení; Zprostředkování v oblasti velkoobchodu za provizi; Ubytování v hotelích a podobných ubytovacích zařízeních; Vydávání knih, novin a ostatní vydavatelské činnosti, kromě vydávání softwaru; Počítačové programování, poradenství a související činnosti; Zprostředkování v oblasti nemovitostí; Poradenství v oblasti podnikání a řízení podniků; Architektonické a inženýrské činnosti a související technické poradenství; Technické zkoušky a analýzy; Reklamní činnosti; Ostatní odborné, vědecké a technické činnosti; Pronájem a leasing výrobků pro osobní potřebu a převážně pro domácnost; Činnosti v oblasti zábavy a rekreace j. n.	aktivní	ano	2009	Jablonec nad Nisou	46601	Aleš Bartoš	181;33200;461;55109;581;620;68310;702;711;7120;731;74;772;93290	Jablonec nad Nisou	2009-02-02
1-5	s.r.o.	28687311	AV-cars s.r.o.	Opravy a údržba motorových vozidel, kromě motocyklů; Zprostředkování v oblasti velkoobchodu za provizi; Nespecializovaný maloobchod; Pronájem a leasing výrobků pro osobní potřebu a převážně pro domácnost	aktivní	ano	2009	Jablonec nad Nisou	46605	Jaroslav Suchánek	45200;461;471;772	Jablonec nad Nisou	2009-01-12
1-5	s.r.o.	28678907	AD Real Invest s.r.o.	Výroba dřevěných, korkových, proutěných a slaměných výrobků; Zprostředkování v oblasti velkoobchodu za provizi; Maloobchod s použitým zbožím; Zprostředkování v oblasti nemovitostí; Výzkum a vývoj v oblasti přírodních a technických věd; Reklamní činnosti; Ostatní odborné, vědecké a technické činnosti; Činnosti cestovních agentur a cestovních kanceláří; Umělecká tvorba a činnosti v oblasti scénických umění	aktivní	ne	2008	Jablonec nad Nisou	46605	Daniel Salamatin	16290;461;47790;68310;7219;731;74;791;900	Jablonec nad Nisou	2008-10-15
1-5	s.r.o.	28676378	CPP Invest s.r.o.	Výroba ostatních textilií j. n.; Opravy a údržba motorových vozidel, kromě motocyklů; Zprostředkování v oblasti velkoobchodu za provizi; Maloobchod; Maloobchod s použitým zbožím; Zprostředkování v oblasti nemovitostí; Ostatní odborné, vědecké a technické činnosti; Ostatní vzdělávání; Činnosti v oblasti sportu, zábavy a rekreace	aktivní	ne	2008	Jablonec nad Nisou	46601	Vladislav Plechatý	13990;45200;461;47;47790;68310;74;855;93	Jablonec nad Nisou	2008-10-09
1-5	s.r.o.	28675754	BETONŘÍZ s.r.o.	Výroba, obchod a služby neuvedené v přílohách 1 až 3 živnostenského zákona; Výroba ostatních výrobků stavebního truhlářství a tesařství; Výroba kovových výrobků, kromě strojů a zařízení; Obkládání stěn a pokládání podlahových krytin; Ostatní specializované stavební činnosti j. n.	aktivní	ano	2008	Jablonec nad Nisou	46605	Miloš Kalina; Jana Adamcová	00;16230;25720;43330;4399	Jablonec nad Nisou	2008-09-17
1-5	s.r.o.	28671066	MID - invest, s.r.o.	Tisk a činnosti související s tiskem; Výroba kovových konstrukcí a jejich dílů; Výroba zámků a kování; Výroba jízdních kol a vozíků pro invalidy; Opravy a údržba ostatních civilních dopravních prostředků a zařízení; Instalace průmyslových strojů a zařízení; Zprostředkování v oblasti velkoobchodu za provizi; Nespecializovaný maloobchod; Počítačové programování, poradenství a související činnosti; Počítačové programování, poradenství a související činnosti; Poskytování počítačové infrastruktury, zpracování dat, hosting a ostatní informační činnosti; Technické zkoušky a analýzy; Výzkum a vývoj v oblasti přírodních a technických věd; Výzkum a vývoj v oblasti společenských a humanitních věd; Ostatní odborné, vědecké a technické činnosti; Pronájem a leasing výrobků pro osobní potřebu a převážně pro domácnost; Ostatní vzdělávání; Poskytování osobních služeb	aktivní	ano	2008	Jablonec nad Nisou	46602	Ivo Dubský	181;25110;25620;30920;3317;33200;461;471;620;62020;63;7120;7219;72200;74;772;855;960	Jablonec nad Nisou	2008-08-04
1-5	s.r.o.	28667891	EPOSAN, s.r.o.	Výroba pryžových a plastových výrobků; Výroba nábytku; Demolice a příprava staveniště; Kompletační a dokončovací stavební práce; Zprostředkování v oblasti velkoobchodu za provizi; Nespecializovaný velkoobchod; Nespecializovaný maloobchod; Zprostředkování v oblasti nemovitostí; Úklidové činnosti	aktivní	ano	2008	Jablonec nad Nisou	46601	Lenka Zedníková	22;310;431;433;461;46900;471;68310;81290	Jablonec nad Nisou	2008-07-19
1-5	s.r.o.	27357279	J.O.POHODA s.r.o.	Destilace, rektifikace a míchaní lihovin; Maloobchod s ostatním novým zbožím; Poskytování stravování v restauracích, u stánků a mobilních zařízení	aktivní	ano	2008	Jablonec nad Nisou	46605	Roman Janďura; Ondřej Otta	11010;4778;56100	Jablonec nad Nisou	2008-04-21
1-5	s.r.o.	27353702	WAPITI, spol. s r.o.	Zprostředkování v oblasti maloobchodu; Ostatní odborné, vědecké a technické činnosti	aktivní	ne	2008			Pavel Habada; Jaroslav Oplt	47990;74		2008-04-08
1-5	s.r.o.	27343120	D.E.A.W.S. Centrum s.r.o.	Výroba neelektrických spotřebičů převážně pro domácnost; Zprostředkování v oblasti velkoobchodu za provizi; Maloobchod; Pronájem a správa vlastních nebo pronajatých nemovitostí; Činnosti cestovních kanceláří; Ostatní rezervační a související činnosti; Balicí činnosti; Činnosti v oblasti sportu	aktivní	ano	2008	Jablonec nad Nisou	46601	Petr Král	27520;461;47;6820;79120;79901;82920;931	Jablonec nad Nisou	2008-01-01
1-5	s.r.o.	27334236	DONA reality s.r.o.	Výroba, obchod a služby neuvedené v přílohách 1 až 3 živnostenského zákona; Podpůrné činnosti pro zemědělství a posklizňové činnosti; Pilařská výroba a impregnace dřeva; zpracování a konečná úprava dřeva; Výroba pryžových a plastových výrobků; Výroba ostatních nekovových minerálních výrobků; Výroba konstrukčních kovových výrobků; Výroba nožířských výrobků, nástrojů a železářských výrobků; Příprava staveniště; Nespecializovaný velkoobchod; Nespecializovaný maloobchod; Pronájem a správa vlastních nebo pronajatých nemovitostí; Reklamní činnosti; Specializované návrhářské činnosti; Fotografické činnosti; Překladatelské a tlumočnické činnosti; Pronájem a leasing výrobků pro osobní potřebu a převážně pro domácnost; Úklidové činnosti; Administrativní a kancelářské činnosti	aktivní	ano	2007	Jablonec nad Nisou	46601	Luke Karaqi; Liridon Karaqi	00;016;16100;22;23;251;256;43120;46900;471;6820;731;74100;74200;74300;772;812;82110	Jablonec nad Nisou	2007-09-11
1-5	s.r.o.	27318303	BIJOUX NONSTOP, s.r.o.	Výroba bižuterie a příbuzných výrobků; Nespecializovaný velkoobchod; Nespecializovaný maloobchod; Maloobchod s ostatním novým zbožím; Zprostředkování v oblasti maloobchodu	aktivní	ano	2007	Jablonec nad Nisou	46601	Jasin Bajrami	32130;46900;471;4778;47990	Jablonec nad Nisou	2007-04-02
1-5	s.r.o.	27316246	Ski Jablonec n.N. s.r.o.	Nespecializovaný maloobchod; Maloobchod s ostatním novým zbožím; Ostatní ubytování; Poskytování stravování v restauracích, u stánků a mobilních zařízení; Reklamní činnosti; Překladatelské a tlumočnické činnosti; Pronájem a leasing výrobků pro osobní potřebu a převážně pro domácnost; Činnosti v oblasti sportu; Poskytování osobních služeb	aktivní	ano	2007	Jablonec nad Nisou	46604	Vladimír Kopal; Jan Hásek	471;4778;5590;56100;731;74300;772;931;96040	Jablonec nad Nisou	2007-02-28
1-5	s.r.o.	27315355	TMSYS s.r.o.	Tisk a činnosti související s tiskem; Zprostředkování v oblasti velkoobchodu za provizi; Nespecializovaný velkoobchod; Zprostředkování v oblasti maloobchodu; Počítačové programování, poradenství a související činnosti; Poskytování počítačové infrastruktury, zpracování dat, hosting a ostatní informační činnosti; Reklamní činnosti; Ostatní odborné, vědecké a technické činnosti	aktivní	ano	2007	Jablonec nad Nisou	46604	Denisa Daniel	181;461;46900;47990;620;63;731;74	Jablonec nad Nisou	2007-02-19
1-5	s.r.o.	27306445	GOALIE HEAVEN s.r.o.	Výroba sportovních potřeb; Zprostředkování v oblasti velkoobchodu za provizi; Nespecializovaný maloobchod; Maloobchod s ostatním novým zbožím; Zprostředkování v oblasti maloobchodu; Reklamní činnosti; Ostatní odborné, vědecké a technické činnosti; Velkoobchod	aktivní	ano	2006	Jablonec nad Nisou	46601	Petr Pluhař	32300;461;471;4778;47990;731;74;46	Jablonec nad Nisou	2006-11-15
1-5	s.r.o.	27298132	studio beruška s.r.o.	Zprostředkování v oblasti velkoobchodu za provizi; Nespecializovaný maloobchod; Maloobchod s ostatním novým zbožím; Ostatní odborné, vědecké a technické činnosti; Ostatní vzdělávání; Činnosti v oblasti sportu; Poskytování osobních služeb	aktivní	ano	2006	Jablonec nad Nisou	46601	Martina Kirschová	461;471;4778;74;855;931;96040	Jablonec nad Nisou	2006-07-18
1-5	s.r.o.	27297276	APS Computer s.r.o.	Poskytování počítačové infrastruktury, zpracování dat, hosting a ostatní informační činnosti; Ostatní poskytování úvěrů j. n.; Činnosti v oblasti nemovitostí na základě smlouvy nebo dohody; Poradenství v oblasti podnikání a řízení podniků; Výroba elektrických zařízení; Nespecializovaný velkoobchod; Nespecializovaný maloobchod; Maloobchod s počítačovým a komunikačním zařízením; Zprostředkování v oblasti maloobchodu; Počítačové programování, poradenství a související činnosti; Výroba elektronických součástek a desek	aktivní	ano	2006	Jablonec nad Nisou	46601	Jiří Masopust	63;64929;683;702;27;46900;471;47410;47990;620;261	Jablonec nad Nisou	2006-06-16
1-5	s.r.o.	27297195	DIGGI spol. s r.o.	Výroba ostatních elektrických zařízení; Nespecializovaný maloobchod; Maloobchod s ostatním novým zbožím; Počítačové programování, poradenství a související činnosti; Poskytování počítačové infrastruktury, zpracování dat, hosting a ostatní informační činnosti	aktivní	ano	2006	Jablonec nad Nisou	46601	Jiří Švarc	27900;471;4778;620;63	Jablonec nad Nisou	2006-06-21
1-5	s.r.o.	27296903	HLAWA creative s.r.o.	Vázání a související činnosti; Zprostředkování v oblasti velkoobchodu za provizi; Nespecializovaný velkoobchod; Nespecializovaný maloobchod; Maloobchod s ostatním novým zbožím; Zprostředkování v oblasti maloobchodu; Reklamní činnosti; Ostatní odborné, vědecké a technické činnosti; Fotografické činnosti; Překladatelské a tlumočnické činnosti; Umělecká tvorba a činnosti v oblasti scénických umění	aktivní	ano	2006	Jablonec nad Nisou	46601	Pavel Winter	18140;461;46900;471;4778;47990;731;74;74200;74300;90040	Jablonec nad Nisou	2006-06-15
1-5	s.r.o.	27291316	CZ Libertad 2024 s.r.o.	Nespecializovaný velkoobchod; Pronájem a správa vlastních nebo pronajatých nemovitostí; Nespecializovaný maloobchod; Poskytování osobních služeb; Činnosti reklamních agentur; Administrativní a kancelářské činnosti; Poskytování ubytování; Činnosti v oblasti sportu j. n.; Výroba, obchod a služby neuvedené v přílohách 1 až 3 živnostenského zákona; Ostatní vzdělávání	aktivní	ano	2006	Jablonec nad Nisou	46601	Klára Tůmová; Pavel Svoboda	46900;6820;471;96040;73110;82110;55;93190;00;855	Jablonec nad Nisou	2006-03-29
1-5	s.r.o.	27287980	KOVOM ZÁMEČNICTVÍ, s.r.o.	Výroba, obchod a služby neuvedené v přílohách 1 až 3 živnostenského zákona; Výroba kovových výrobků, kromě strojů a zařízení; Pronájem a správa vlastních nebo pronajatých nemovitostí; Pronájem a správa vlastních nebo pronajatých nemovitostí	aktivní	ano	2006	Jablonec nad Nisou	46605	Karel Mráz	00;257;68203;68204	Jablonec nad Nisou	2006-02-20
1-5	s.r.o.	27282457	JMMX s.r.o.	Poskytování počítačové infrastruktury, zpracování dat, hosting a ostatní informační činnosti; Reklamní činnosti; Výroba ostatních elektrických zařízení; Nespecializovaný maloobchod; Maloobchod s ostatním novým zbožím; Počítačové programování, poradenství a související činnosti	aktivní	ano	2005	Jablonec nad Nisou	46601	Jiří Marx; Miroslava Marxová	63;731;27900;471;4778;620	Jablonec nad Nisou	2005-12-05
1-5	s.r.o.	27281761	MAGONA s.r.o.	Nespecializovaný velkoobchod; Nespecializovaný maloobchod	aktivní	ano	2005	Jablonec nad Nisou	46602	Leoš Richter	46900;471	Jablonec nad Nisou	2005-11-25
1-5	s.r.o.	27281574	Brick & Cotto experts s.r.o.	Výstavba bytových a nebytových budov; Specializované stavební činnosti; Zprostředkování v oblasti velkoobchodu za provizi; Nespecializovaný velkoobchod; Maloobchod s železářským zbožím, stavebními materiály, barvami a sklem; Skladování	aktivní	ano	2005	Jablonec nad Nisou	46601	Pavel Kratochvíl; David Rudolf	4120;43;461;46900;47520;52100	Jablonec nad Nisou	2005-12-06
1-5	s.r.o.	27263011	FRAPE PHARMA s.r.o.	Nespecializovaný velkoobchod; Maloobchod s nápoji; Maloobchod s farmaceutickými výrobky	aktivní	ano	2005	Jablonec nad Nisou	46604	Peter Fratrič; Dana Fratričová	46900;47250;47730	Jablonec nad Nisou	2005-01-19
1-5	s.r.o.	27064280	QUEENFORD s.r.o.	Skladování; Ostatní poštovní a kurýrní činnosti; Pronájem a správa vlastních nebo pronajatých nemovitostí; Ostatní odborné, vědecké a technické činnosti	aktivní	ano	2003	Jablonec nad Nisou	46604	Martin Juris	52100;53200;6820;74	Jablonec nad Nisou	2003-05-28
1-5	s.r.o.	26869098	ALVASTAT s.r.o.	Zprostředkování v oblasti velkoobchodu za provizi; Zprostředkování v oblasti nemovitostí; Poradenství v oblasti podnikání a řízení podniků; Architektonické a inženýrské činnosti a související technické poradenství	aktivní	ano	2005	Jablonec nad Nisou	46801	Darja Vacková; Aleš Vacek	461;68310;702;711	Jablonec nad Nisou	2005-08-26
1-5	s.r.o.	26029049	XIXAO, s.r.o.	Výroba, obchod a služby neuvedené v přílohách 1 až 3 živnostenského zákona; Skládkování nebo trvalé uložení odpadů; Nespecializovaný velkoobchod; Maloobchod s ostatním novým zbožím; Poskytování stravování v restauracích, u stánků a mobilních zařízení	aktivní	ano	2000	Jablonec nad Nisou	46605	Dušan Hájek	00;38320;46900;4778;56100	Jablonec nad Nisou	2000-11-07
1-5	s.r.o.	25498673	DYNWEB, s.r.o.	Zprostředkování v oblasti velkoobchodu za provizi; Nespecializovaný velkoobchod; Maloobchod; Počítačové programování, poradenství a související činnosti; Poskytování počítačové infrastruktury, zpracování dat, hosting a ostatní informační činnosti; Architektonické a inženýrské činnosti a související technické poradenství; Reklamní činnosti	aktivní	ano	2004	Jablonec nad Nisou	46601	Tomáš Hluštík; Tomáš Bien	461;46900;47;620;63;711;731	Jablonec nad Nisou	2004-12-01
1-5	s.r.o.	25498002	Global Mobile Multimedia CZ s.r.o.	Výroba elektrických motorů, generátorů a transformátorů; Výroba elektrického a elektronického zařízení pro motorová vozidla; Nespecializovaný velkoobchod; Maloobchod s počítačovým a komunikačním zařízením; Maloobchod s elektrospotřebiči a elektronikou převážně pro domácnost; Zprostředkování v oblasti maloobchodu; Pořizování zvukových nahrávek a hudební vydavatelské činnosti; Zastupování médií při prodeji reklamního času a prostoru; Výroba, obchod a služby neuvedené v přílohách 1 až 3 živnostenského zákona; Počítačové programování, poradenství a související činnosti	aktivní	ano	2004	Jablonec nad Nisou	46606	Michal Paldus	27110;29310;46900;47420;47540;47990;59200;73120;00;62030	Jablonec nad Nisou	2004-11-10
1-5	s.r.o.	25497791	AGEP s.r.o.	Ostatní zpracovatelský průmysl; Demolice a příprava staveniště; Zprostředkování v oblasti velkoobchodu za provizi; Nespecializovaný velkoobchod; Nespecializovaný maloobchod; Ostatní ubytování; Zprostředkování v oblasti nemovitostí; Účetnické a auditorské činnosti; daňové poradenství; Ostatní odborné, vědecké a technické činnosti j. n.	aktivní	ano	2004	Jablonec nad Nisou	46604	Petr Šída; Michaela Müllerová	32;431;461;46900;471;55909;68310;69200;7490	Jablonec nad Nisou	2004-11-09
1-5	s.r.o.	25497022	LISTROVNA s.r.o.	Výroba skla a skleněných výrobků; Zprostředkování v oblasti velkoobchodu za provizi; Maloobchod s ostatním novým zbožím	aktivní	ano	2004	Jablonec nad Nisou	46604	Lenka Mattatall; Vratislav Souček	23190;461;4778	Jablonec nad Nisou	2004-10-22
1-5	s.r.o.	25491199	Klucká s.r.o.	Výroba, obchod a služby neuvedené v přílohách 1 až 3 živnostenského zákona; Výroba pletených a háčkovaných oděvů; Výroba bižuterie a příbuzných výrobků; Nespecializovaný velkoobchod; Maloobchod s ostatním novým zbožím; Specializované návrhářské činnosti	aktivní	ano	2004	Jablonec nad Nisou	46604	Iva Klucká	00;141;32130;46900;4778;74100	Jablonec nad Nisou	2004-06-29
1-5	s.r.o.	25490575	TOPDANCE Jäger s.r.o.	Zprostředkování v oblasti velkoobchodu za provizi; Nespecializovaný velkoobchod; Nespecializovaný maloobchod; Ostatní vzdělávání; Činnosti v oblasti zábavy a rekreace j. n.	aktivní	ne	2004	Jablonec nad Nisou	46601	Libor Jäger	461;46900;471;855;93290	Jablonec nad Nisou	2004-06-07
1-5	s.r.o.	25484630	EVESA s.r.o.	Nespecializovaný maloobchod; Poskytování ubytování; Nespecializovaný velkoobchod; Pronájem a správa vlastních nebo pronajatých nemovitostí	aktivní	ano	2004	Jablonec nad Nisou	46604	Miroslav Bien; Pavel Krejčík	471;55;46900;6820	Jablonec nad Nisou	2004-03-01
