velikost	forma	ico	nazev	obor_podnikani	status	platce_dph	rok_vzniku	obec	psc	statutari	nace_kody	okres	datum_vzniku
neuv.	s.r.o.	23756799	Hnídek Real SH, s.r.o.	Výroba, obchod a služby neuvedené v přílohách 1 až 3 živnostenského zákona; Nespecializovaný maloobchod; Administrativní a kancelářské činnosti; Nespecializovaný velkoobchod; Pronájem a leasing výrobků pro osobní potřebu a převážně pro domácnost; Pronájem a správa vlastních nebo pronajatých nemovitostí	aktivní	ano	2025	Jablonec nad Nisou	46604	Tomáš Hnídek; Tomáš Šilhánek; Stanislav Havelka	00;471;82110;46900;77290;6820	Jablonec nad Nisou	2025-10-01
neuv.	s.r.o.	23747501	Holub & Hudský - HH Building s.r.o.	Sběr odpadů, kromě nebezpečných; Výroba, obchod a služby neuvedené v přílohách 1 až 3 živnostenského zákona; Inženýrské činnosti a související technické poradenství; Pronájem a správa vlastních nebo pronajatých nemovitostí; Nespecializovaný velkoobchod; Pronájem a leasing výrobků pro osobní potřebu a převážně pro domácnost; Nespecializovaný maloobchod; Příprava staveniště; Úklidové činnosti; Skladování a podpůrné činnosti pro dopravu	aktivní	ano	2025	Jablonec nad Nisou	46601	Jiří Hudský; Daniel Holub	38110;00;7112;6820;46900;77290;471;43120;81290;52	Jablonec nad Nisou	2025-09-22
neuv.	s.r.o.	23707941	HORDOMY s.r.o.	Výroba, obchod a služby neuvedené v přílohách 1 až 3 živnostenského zákona; Pronájem a správa vlastních nebo pronajatých nemovitostí; Nespecializovaný velkoobchod; Příprava staveniště; Administrativní a kancelářské činnosti; Nespecializovaný maloobchod	aktivní	ne	2025	Jablonec nad Nisou	46606	Jindřich Zeman	00;6820;46900;43120;82110;471	Jablonec nad Nisou	2025-09-10
neuv.	s.r.o.	23592222	RS Motronix s.r.o.	Činnosti reklamních agentur; Výzkum a vývoj v oblasti přírodních a technických věd; Výroba, obchod a služby neuvedené v přílohách 1 až 3 živnostenského zákona; Opravy a údržba motorových vozidel, kromě motocyklů; Počítačové programování, poradenství a související činnosti; Výroba motorových vozidel; Inženýrské činnosti a související technické poradenství; Nespecializovaný maloobchod; Technické zkoušky a analýzy	aktivní	ano	2025	Jablonec nad Nisou	46601	Radek Sčensný	73110;7219;00;45200;620;29100;7112;471;71209	Jablonec nad Nisou	2025-08-12
neuv.	s.r.o.	23507004	BackLab s.r.o.	Nespecializovaný maloobchod; Pronájem a leasing výrobků pro osobní potřebu a převážně pro domácnost; Výroba, obchod a služby neuvedené v přílohách 1 až 3 živnostenského zákona; Ostatní zpracovatelský průmysl; Nespecializovaný velkoobchod; Skladování a podpůrné činnosti pro dopravu; Úklidové činnosti; Výzkum a vývoj v oblasti přírodních a technických věd	aktivní	ano	2025	Jablonec nad Nisou	46601	Michal Fiala	471;77290;00;32;46900;52;81290;7219	Jablonec nad Nisou	2025-08-06
neuv.	s.r.o.	23421665	SVĚTLOSTROJ s.r.o.	Výroba, obchod a služby neuvedené v přílohách 1 až 3 živnostenského zákona; Nespecializovaný velkoobchod; Činnosti reklamních agentur; Specializované návrhářské činnosti; Inženýrské činnosti a související technické poradenství; Pronájem a leasing výrobků pro osobní potřebu a převážně pro domácnost; Umělecká tvorba a činnosti v oblasti scénických umění; Počítačové programování, poradenství a související činnosti; Fotografické činnosti	aktivní	ne	2025	Jablonec nad Nisou	46604	Jiří Hořavka	00;46900;73110;74100;7112;77290;90020;620;74200	Jablonec nad Nisou	2025-06-23
neuv.	s.r.o.	23317761	SEVER ENERGO, s.r.o.	Výroba strojů a zařízení j. n.; Nespecializovaný maloobchod; Výroba měřicích, zkušebních a časoměrných přístrojů; Nespecializovaný velkoobchod; Počítačové programování, poradenství a související činnosti; Sběr odpadů, kromě nebezpečných; Pronájem a leasing výrobků pro osobní potřebu a převážně pro domácnost; Opravy a údržba výrobků pro osobní potřebu a převážně pro domácnost; Pronájem a správa vlastních nebo pronajatých nemovitostí; Výroba konstrukčních kovových výrobků; Ostatní zpracovatelský průmysl; Činnosti řízení podniků; Výroba, obchod a služby neuvedené v přílohách 1 až 3 živnostenského zákona; Opravy a údržba kovových výrobků, strojů a zařízení; Příprava staveniště; Administrativní a kancelářské činnosti; Instalace průmyslových strojů a zařízení; Inženýrské činnosti a související technické poradenství; Úklidové činnosti; Výzkum a vývoj v oblasti přírodních a technických věd; Technické zkoušky a analýzy	aktivní	ne	2025	Jablonec nad Nisou	46604	Filip Svoboda; Jaroslav Strnad; Martin Pacholík	28;471;265;46900;620;38110;77290;952;6820;251;32;70100;00;331;43120;82110;33200;7112;81290;7219;71209	Jablonec nad Nisou	2025-05-26
neuv.	s.r.o.	23311851	TEAM4NET s.r.o.	Administrativní a kancelářské činnosti; Pronájem a leasing výrobků pro osobní potřebu a převážně pro domácnost; Nespecializovaný velkoobchod; Nespecializovaný maloobchod; Počítačové programování, poradenství a související činnosti	aktivní	ne	2025	Jablonec nad Nisou	46601	Petr Pavlata	82110;77290;46900;471;620	Jablonec nad Nisou	2025-05-23
neuv.	s.r.o.	23268603	TERMIL project 21 Alfa s.r.o.	Nespecializovaný maloobchod; Výroba, obchod a služby neuvedené v přílohách 1 až 3 živnostenského zákona; Administrativní a kancelářské činnosti; Pronájem a správa vlastních nebo pronajatých nemovitostí; Nespecializovaný velkoobchod; Pronájem a leasing výrobků pro osobní potřebu a převážně pro domácnost	aktivní	ne	2025	Jablonec nad Nisou	46605	Libor Milota	471;00;82110;6820;46900;77290	Jablonec nad Nisou	2025-05-16
neuv.	s.r.o.	23071800	Legiasia Group s.r.o.	Výroba potravinářských výrobků; Nespecializovaný velkoobchod; Nespecializovaný maloobchod; Destilace, rektifikace a míchaní lihovin	aktivní	ano	2025	Jablonec nad Nisou	46602	Viét Đúc Lé	10;46900;471;11010	Jablonec nad Nisou	2025-03-17
neuv.	s.r.o.	23065648	Benee Group s.r.o.	Počítačové programování, poradenství a související činnosti; Činnosti reklamních agentur; Administrativní a kancelářské činnosti; Výroba, obchod a služby neuvedené v přílohách 1 až 3 živnostenského zákona	aktivní	ne	2025	Jablonec nad Nisou	46601	Jakub Růta; Jakub Vrbický	620;73110;82110;00	Jablonec nad Nisou	2025-03-16
neuv.	s.r.o.	22800794	IDMAR CZ s.r.o.	Výroba, obchod a služby neuvedené v přílohách 1 až 3 živnostenského zákona; Výroba pryžových a plastových výrobků; Výroba nožířských výrobků, nástrojů a železářských výrobků; Výroba strojů a zařízení j. n.; Shromažďování, úprava a distribuce vody; Sběr odpadů; Demolice a příprava staveniště; Zprostředkování v oblasti velkoobchodu za provizi; Nespecializovaný velkoobchod; Nespecializovaný maloobchod; Ostatní vydavatelské činnosti, kromě vydávání softwaru; Zprostředkování v oblasti nemovitostí; Pronájem a leasing výrobků pro osobní potřebu a převážně pro domácnost	aktivní	ne	2012	Jablonec nad Nisou	46601	Tomáš Novák; Miroslav Stejskal; Vojtěch Švec	00;22;256;28;36000;381;431;461;46900;471;58190;68310;77290	Jablonec nad Nisou	2012-11-29
neuv.	s.r.o.	22798510	IN-SERVICES s.r.o.	Výroba kovových konstrukcí a jejich dílů; Výroba strojů a zařízení j. n.; Zprostředkování v oblasti velkoobchodu za provizi; Nespecializovaný velkoobchod; Nespecializovaný maloobchod; Ubytování v hotelích a podobných ubytovacích zařízeních; Počítačové programování, poradenství a související činnosti; Zprostředkování v oblasti nemovitostí; Inženýrské činnosti a související technické poradenství; Ostatní odborné, vědecké a technické činnosti j. n.; Pronájem a leasing výrobků pro osobní potřebu a převážně pro domácnost	aktivní	ano	2012	Jablonec nad Nisou	46804	Petra Doubková	25110;28;461;46900;471;55109;620;68310;7112;7490;77290	Jablonec nad Nisou	2012-10-12
neuv.	s.r.o.	22795502	ZIELBAU.CZ s.r.o.	Výstavba bytových a nebytových budov; Specializované stavební činnosti; Zprostředkování v oblasti velkoobchodu za provizi; Nespecializovaný velkoobchod; Nespecializovaný maloobchod; Architektonické činnosti; Ostatní odborné, vědecké a technické činnosti j. n.	aktivní	ano	2012	Jablonec nad Nisou	46801	Jan Mynář	4120;43;461;46900;471;71110;7490	Jablonec nad Nisou	2012-06-21
neuv.	s.r.o.	22794778	E-PORT s.r.o.	Výroba elektrických zařízení; Elektrické instalace; Opravy a údržba motorových vozidel, kromě motocyklů; Zprostředkování v oblasti velkoobchodu za provizi; Nespecializovaný velkoobchod; Nespecializovaný maloobchod; Počítačové programování, poradenství a související činnosti; Zprostředkování v oblasti nemovitostí; Inženýrské činnosti a související technické poradenství; Administrativní a kancelářské činnosti; Ostatní vzdělávání j. n.	aktivní	ne	2012	Jablonec nad Nisou	46601	Zdeněk Beránek; Michal Poláček	27;43210;45200;461;46900;471;620;68310;7112;821;8559	Jablonec nad Nisou	2012-06-22
neuv.	s.r.o.	22792821	CK-net s.r.o.	Výroba konstrukčních kovových výrobků; Výroba strojů a zařízení j. n.; Velkoobchod; Činnosti reklamních agentur; Opravy a údržba kovových výrobků, strojů a zařízení; Výroba, obchod a služby neuvedené v přílohách 1 až 3 živnostenského zákona; Výroba nožířských výrobků, nástrojů a železářských výrobků; Opravy, údržba a instalace strojů a zařízení; Nespecializovaný maloobchod; Počítačové programování, poradenství a související činnosti; Inženýrské činnosti a související technické poradenství; Činnosti v oblasti sportu j. n.	aktivní	ano	2012	Jablonec nad Nisou	46602	Marek Brož	251;28;46;73110;331;00;256;33;471;620;7112;93190	Jablonec nad Nisou	2012-04-12
neuv.	s.r.o.	22774335	ROCKWAY s.r.o.	Výroba, obchod a služby neuvedené v přílohách 1 až 3 živnostenského zákona; Výroba oděvů; Výroba pryžových a plastových výrobků; Ostatní zpracovatelský průmysl; Nespecializovaný velkoobchod; Maloobchod s použitým zbožím; Pronájem a správa vlastních nebo pronajatých nemovitostí	aktivní	ne	2012	Jablonec nad Nisou	46804	Veronika Lacmanová	00;14;22;32;46900;47790;6820	Jablonec nad Nisou	2012-03-27
neuv.	s.r.o.	22773851	TJS spol. s r.o.	Výroba, obchod a služby neuvedené v přílohách 1 až 3 živnostenského zákona; Opravy, údržba a instalace strojů a zařízení; Instalace průmyslových strojů a zařízení; Elektroinstalační, instalatérské a ostatní stavebně instalační činnosti; Opravy a údržba výrobků pro osobní potřebu a převážně pro domácnost	aktivní	ne	2012	Markvartice	50743	Tomáš Jehlička	00;33;33200;432;952	Jičín	2012-03-12
neuv.	s.r.o.	22773312	MHM Fashion, s.r.o.	Výroba kovových výrobků, kromě strojů a zařízení; Ostatní zpracovatelský průmysl; Nespecializovaný velkoobchod; Nespecializovaný maloobchod	aktivní	ano	2012	Jablonec nad Nisou	46804	Marcela Heralecká; Zuzana Egrtová	25;32;46900;471	Jablonec nad Nisou	2012-02-16
neuv.	s.r.o.	22589155	FreshRoof s.r.o.	Ostatní vzdělávání; Výzkum a vývoj v oblasti přírodních a technických věd; Nespecializovaný velkoobchod; Výroba, obchod a služby neuvedené v přílohách 1 až 3 živnostenského zákona; Podpůrné činnosti pro zemědělství a posklizňové činnosti; Smíšené hospodaření; Pronájem a leasing výrobků pro osobní potřebu a převážně pro domácnost; Inženýrské činnosti a související technické poradenství; Nespecializovaný maloobchod; Podpůrné činnosti pro rostlinnou výrobu; Technické zkoušky a analýzy; Umělecká tvorba a činnosti v oblasti scénických umění	aktivní	ano	2025	Jablonec nad Nisou	46604	Tereza Nalezená	855;7219;46900;00;016;01500;77290;7112;471;01610;71209;90020	Jablonec nad Nisou	2025-02-13
neuv.	s.r.o.	22580310	BNK akademie s.r.o.	Ostatní vzdělávání; Nespecializovaný maloobchod; Nespecializovaný velkoobchod; Výroba, obchod a služby neuvedené v přílohách 1 až 3 živnostenského zákona; Poskytování osobních služeb	aktivní	ne	2025	Jablonec nad Nisou	46606	Barbora Nágl Králová	855;471;46900;00;96090	Jablonec nad Nisou	2025-02-13
neuv.	s.r.o.	22517502	RusTEQ s.r.o.	Výroba chemických látek a chemických výrobků; Technické zkoušky a analýzy; Pronájem a správa vlastních nebo pronajatých nemovitostí; Opravy a údržba motorových vozidel, kromě motocyklů; Činnosti reklamních agentur; Pronájem a leasing výrobků pro osobní potřebu a převážně pro domácnost; Výroba nožířských výrobků, nástrojů a železářských výrobků; Výroba, obchod a služby neuvedené v přílohách 1 až 3 živnostenského zákona; Skladování a podpůrné činnosti pro dopravu; Sběr odpadů, kromě nebezpečných; Nespecializovaný velkoobchod; Nespecializovaný maloobchod	aktivní	ano	2025	Jablonec nad Nisou	46604	Richard Tkačík; Petr Vaverka	20;71209;6820;45200;73110;77290;256;00;52;38110;46900;471	Jablonec nad Nisou	2025-02-03
neuv.	s.r.o.	22450955	TOREX PROJEKT, s.r.o.	Počítačové programování, poradenství a související činnosti; Ostatní vzdělávání; Opravy, údržba a instalace strojů a zařízení; Nespecializovaný maloobchod; Ostatní odborné, vědecké a technické činnosti j. n.; Instalace průmyslových strojů a zařízení; Nespecializovaný velkoobchod; Pronájem a leasing výrobků pro osobní potřebu a převážně pro domácnost; Činnosti reklamních agentur; Administrativní a kancelářské činnosti; Výroba pryžových a plastových výrobků; Výroba, obchod a služby neuvedené v přílohách 1 až 3 živnostenského zákona; Technické zkoušky a analýzy; Úklidové činnosti; Inženýrské činnosti a související technické poradenství; Sběr odpadů, kromě nebezpečných; Ostatní odborné, vědecké a technické činnosti j. n.	aktivní	ne	2025	Jablonec nad Nisou	46804	Petr Holouš	620;855;33;471;74902;33200;46900;77290;73110;82110;22;00;71209;81290;7112;38110;74901	Jablonec nad Nisou	2025-01-09
neuv.	s.r.o.	22448209	TIKKO s.r.o.	Poskytování stravování v restauracích, u stánků a mobilních zařízení; Nespecializovaný maloobchod; Nespecializovaný velkoobchod; Výroba potravinářských výrobků; Výroba pekařských, cukrářských a jiných moučných výrobků; Činnosti reklamních agentur; Destilace, rektifikace a míchaní lihovin; Pronájem a leasing výrobků pro osobní potřebu a převážně pro domácnost; Výroba, obchod a služby neuvedené v přílohách 1 až 3 živnostenského zákona	aktivní	ne	2025	Jablonec nad Nisou	46602	Martin Kotyza	56100;471;46900;10;107;73110;11010;77290;00	Jablonec nad Nisou	2025-01-28
neuv.	s.r.o.	22394214	Žabka a Žabka s.r.o.	Nespecializovaný maloobchod; Pronájem a správa vlastních nebo pronajatých nemovitostí; Nespecializovaný velkoobchod; Poskytování ubytování; Výroba, obchod a služby neuvedené v přílohách 1 až 3 živnostenského zákona	aktivní	ano	2024	Jablonec nad Nisou	46601	Pavla Žabková; Miroslav Žabka	471;6820;46900;55;00	Jablonec nad Nisou	2024-12-19
neuv.	s.r.o.	22293540	REKA ONE, s.r.o.	Nespecializovaný maloobchod; Činnosti reklamních agentur; Administrativní a kancelářské činnosti; Výroba, obchod a služby neuvedené v přílohách 1 až 3 živnostenského zákona; Nespecializovaný velkoobchod; Počítačové programování, poradenství a související činnosti; Pronájem a správa vlastních nebo pronajatých nemovitostí	aktivní	ne	2024	Jablonec nad Nisou	46601	Tereza Hanušová	471;73110;82110;00;46900;620;6820	Jablonec nad Nisou	2024-11-22
neuv.	s.r.o.	22246819	Ennos Technology s.r.o.	Skladování a podpůrné činnosti pro dopravu; Činnosti webových vyhledávacích portálů; Výroba oděvů; Ostatní vzdělávání; Maloobchod s použitým zbožím; Specializované návrhářské činnosti; Nespecializovaný maloobchod; Umělecká tvorba a činnosti v oblasti scénických umění; Pronájem a leasing výrobků pro osobní potřebu a převážně pro domácnost; Pronájem a správa vlastních nebo pronajatých nemovitostí; Činnosti reklamních agentur; Technické zkoušky a analýzy; Výroba, obchod a služby neuvedené v přílohách 1 až 3 živnostenského zákona; Fotografické činnosti; Počítačové programování, poradenství a související činnosti; Inženýrské činnosti a související technické poradenství	aktivní	ano	2024	Jablonec nad Nisou	46605	Ondřej Banasiewicz	52;63910;14;855;47790;74100;471;90020;7729;6820;73110;71209;00;74200;620;7112	Jablonec nad Nisou	2024-11-11
neuv.	s.r.o.	22243348	RRT Group s.r.o.	Skladování a podpůrné činnosti pro dopravu; Výroba strojů a zařízení j. n.; Technické zkoušky a analýzy; Příprava staveniště; Ostatní vzdělávání; Inženýrské činnosti a související technické poradenství; Opravy a údržba výrobků pro osobní potřebu a převážně pro domácnost; Úklidové činnosti; Výroba nožířských výrobků, nástrojů a železářských výrobků; Administrativní a kancelářské činnosti; Sběr odpadů, kromě nebezpečných; Pronájem a leasing výrobků pro osobní potřebu a převážně pro domácnost; Nespecializovaný maloobchod; Výroba, obchod a služby neuvedené v přílohách 1 až 3 živnostenského zákona; Výroba konstrukčních kovových výrobků	aktivní	ne	2024	Jablonec nad Nisou	46601	Radim Košek	52;28;71209;43120;855;7112;952;81290;256;82110;38110;772;471;00;251	Jablonec nad Nisou	2024-11-07
neuv.	s.r.o.	22187669	DÝLEJC s.r.o.	Nespecializovaný maloobchod; Výroba oděvů; Nespecializovaný velkoobchod	aktivní	ano	2024	Jablonec nad Nisou	46601	Radim Feix	471;14;46900	Jablonec nad Nisou	2024-10-23
neuv.	s.r.o.	22174427	EG SOLGEL, s.r.o.	Výroba, obchod a služby neuvedené v přílohách 1 až 3 živnostenského zákona; Činnosti reklamních agentur; Umělecká tvorba a činnosti v oblasti scénických umění; Ostatní vzdělávání; Výroba skla a skleněných výrobků; Administrativní a kancelářské činnosti; Nespecializovaný maloobchod; Pronájem a leasing výrobků pro osobní potřebu a převážně pro domácnost; Inženýrské činnosti a související technické poradenství	aktivní	ne	2024	Jablonec nad Nisou	46604	Helena Krutská; Jan Krutský	00;73110;90020;855;231;82110;471;772;7112	Jablonec nad Nisou	2024-10-18
neuv.	s.r.o.	22122214	Naše doktorka s.r.o.	Pronájem a leasing výrobků pro osobní potřebu a převážně pro domácnost; Nespecializovaný maloobchod; Velkoobchod; Výroba, obchod a služby neuvedené v přílohách 1 až 3 živnostenského zákona	aktivní	ne	2024	Jablonec nad Nisou	46604	Věra Fastrová	772;471;46;00	Jablonec nad Nisou	2024-10-03
neuv.	s.r.o.	22122150	JABMONT s.r.o.	Velkoobchod; Pronájem a správa vlastních nebo pronajatých nemovitostí; Nespecializovaný maloobchod; Příprava staveniště; Ostatní vzdělávání; Výroba, obchod a služby neuvedené v přílohách 1 až 3 živnostenského zákona; Činnosti reklamních agentur; Úklidové činnosti	aktivní	ano	2024	Jablonec nad Nisou	46601	Milan Dytrych	46;6820;471;43120;855;00;73110;81290	Jablonec nad Nisou	2024-10-03
neuv.	s.r.o.	22122133	STALETA s.r.o.	Velkoobchod; Ostatní vzdělávání; Výroba, obchod a služby neuvedené v přílohách 1 až 3 živnostenského zákona; Činnosti reklamních agentur; Pronájem a správa vlastních nebo pronajatých nemovitostí; Příprava staveniště; Úklidové činnosti; Nespecializovaný maloobchod	aktivní	ano	2024	Jablonec nad Nisou	46601	Milan Dytrych	46;855;00;73110;6820;43120;81290;471	Jablonec nad Nisou	2024-10-03
neuv.	s.r.o.	22097261	STROMY BEZ RIZIKA s.r.o.	Výroba strojů a zařízení j. n.; Nespecializovaný maloobchod; Výroba, obchod a služby neuvedené v přílohách 1 až 3 živnostenského zákona; Podpůrné činnosti pro zemědělství a posklizňové činnosti; Pilařská výroba a impregnace dřeva; zpracování a konečná úprava dřeva	aktivní	ano	2024	Jablonec nad Nisou	46604	Daniel Valášek	28;471;00;016;16100	Jablonec nad Nisou	2024-09-27
neuv.	s.r.o.	22096337	3D Sphynx s.r.o.	Velkoobchod; Výroba chemických látek a chemických výrobků; Nespecializovaný maloobchod; Inženýrské činnosti a související technické poradenství; Ostatní vzdělávání; Výroba kovových výrobků, kromě strojů a zařízení; Výroba strojů a zařízení j. n.; Výroba pryžových a plastových výrobků; Opravy a údržba výrobků pro osobní potřebu a převážně pro domácnost	aktivní	ano	2024	Jablonec nad Nisou	46601	Lukáš Vávra	46;20;471;7112;855;257;28;22;952	Jablonec nad Nisou	2024-09-27
neuv.	s.r.o.	21967954	PLASTIME.VL s.r.o.	Inženýrské činnosti a související technické poradenství; Nespecializovaný maloobchod; Výzkum a vývoj v oblasti přírodních a technických věd; Výroba pryžových a plastových výrobků; Výroba, obchod a služby neuvedené v přílohách 1 až 3 živnostenského zákona; Ostatní zpracovatelský průmysl; Příprava staveniště; Technické zkoušky a analýzy; Výroba nožířských výrobků, nástrojů a železářských výrobků; Výroba strojů a zařízení j. n.; Pronájem a správa vlastních nebo pronajatých nemovitostí; Úklidové činnosti; Výroba surového železa, oceli a feroslitin; Sběr odpadů, kromě nebezpečných; Výroba konstrukčních kovových výrobků	aktivní	ne	2024	Jablonec nad Nisou	46801	Oldřich Vránek; Jan Labus	7112;471;7219;22;00;32;43120;71209;256;28;6820;812;241;38110;251	Jablonec nad Nisou	2024-09-04
neuv.	s.r.o.	21830754	OKKIO s.r.o.	Velkoobchod; Činnosti reklamních agentur; Ostatní vzdělávání; Umělecká tvorba a činnosti v oblasti scénických umění; Výroba, obchod a služby neuvedené v přílohách 1 až 3 živnostenského zákona; Maloobchod s ostatním novým zbožím	aktivní	ne	2024	Jablonec nad Nisou	46606	Adéla Holubcová; Barbora Holubcová	46;73110;855;90020;00;4778	Jablonec nad Nisou	2024-07-17
neuv.	s.r.o.	21727201	Ložnice-Jablonec s.r.o.	Maloobchod s ostatními výrobky převážně pro domácnost; Velkoobchod; Činnosti reklamních agentur; Silniční nákladní doprava	aktivní	ne	2024	Jablonec nad Nisou	46602	Tomáš Labuda	47590;46;73110;49410	Jablonec nad Nisou	2024-06-17
neuv.	s.r.o.	21667276	ARP.CZ s.r.o.	Počítačové programování, poradenství a související činnosti; Maloobchod; Inženýrské činnosti a související technické poradenství; Činnosti reklamních agentur; Ostatní vzdělávání; Pronájem a správa vlastních nebo pronajatých nemovitostí; Velkoobchod; Činnosti webových vyhledávacích portálů; Výroba, obchod a služby neuvedené v přílohách 1 až 3 živnostenského zákona	aktivní	ne	2024	Jablonec nad Nisou	46602	Jan Polák; Radim Daniel Pánek; Štěpán Matek	620;47;7112;73110;855;6820;46;63910;00	Jablonec nad Nisou	2024-05-30
neuv.	s.r.o.	21626197	IVICONIC s.r.o.	Skladování a podpůrné činnosti pro dopravu; Podpůrné činnosti pro dopravu; Maloobchod; Administrativní a kancelářské činnosti; Velkoobchod	aktivní	ano	2024	Jablonec nad Nisou	46606	Ivana Torelli	52;52290;47;82110;46	Jablonec nad Nisou	2024-05-20
neuv.	s.r.o.	21599661	MAGATIG s.r.o.	Skladování a podpůrné činnosti pro dopravu; Výroba strojů a zařízení j. n.; Výroba nožířských výrobků, nástrojů a železářských výrobků; Příprava staveniště; Poskytování ubytování; Velkoobchod; Ostatní zpracovatelský průmysl; Maloobchod; Výroba konstrukčních kovových výrobků; Výroba papíru a výrobků z papíru; Výroba pryžových a plastových výrobků; Pronájem a správa vlastních nebo pronajatých nemovitostí; Výroba oděvů	aktivní	ne	2024	Jablonec nad Nisou	46602	Petr Novák	52;28;256;43120;55;46;32;47;251;17;22;6820;14	Jablonec nad Nisou	2024-06-12
neuv.	s.r.o.	21599611	VINOTREND CZ s.r.o.	Poskytování ubytování; Velkoobchod; Výroba nožířských výrobků, nástrojů a železářských výrobků; Výroba papíru a výrobků z papíru; Výroba strojů a zařízení j. n.; Pronájem a správa vlastních nebo pronajatých nemovitostí; Ostatní zpracovatelský průmysl; Výroba oděvů; Výroba konstrukčních kovových výrobků; Maloobchod; Výroba pryžových a plastových výrobků; Příprava staveniště	aktivní	ne	2024	Jablonec nad Nisou	46602	Petr Novák	55;46;256;17;28;6820;32;14;251;47;22;43120	Jablonec nad Nisou	2024-06-12
neuv.	s.r.o.	21446628	AVALON property services s.r.o.	Velkoobchod; Činnosti reklamních agentur; Nespecializovaný maloobchod; Výroba, obchod a služby neuvedené v přílohách 1 až 3 živnostenského zákona; Ostatní vzdělávání; Umělecká tvorba a činnosti v oblasti scénických umění; Pronájem a leasing výrobků pro osobní potřebu a převážně pro domácnost; Administrativní a kancelářské činnosti; Pronájem a správa vlastních nebo pronajatých nemovitostí	aktivní	ne	2024	Jablonec nad Nisou	46601	Martin Rota	46;73110;471;00;855;90020;772;82110;6820	Jablonec nad Nisou	2024-04-09
neuv.	s.r.o.	21367523	Wermandler s.r.o.	Počítačové programování, poradenství a související činnosti; Pronájem a leasing výrobků pro osobní potřebu a převážně pro domácnost	aktivní	ne	2024	Jablonec nad Nisou	46605	Miroslav Vavřín	620;772	Jablonec nad Nisou	2024-03-15
